資源エネルギー庁が23日発表した21日時点のレギュラーガソリンの店頭価格は前週比1.1円上昇し、1リットル155.6円だった。	<政府活動>,<日本>,<指数・統計>
中国政府は23日、国有IT大手2社の経営統合を認可したと発表した。	<政府活動>,<中国>,<法整備・規制>
筆頭株主である仏政府の意向も背景にあり、同社は2030年までに温暖化ガス排出量を05年比で実質半分にする目標達成に弾みをつける。	
ただメキシコ政府は民間のEV向け投資の後押しに消極的なままで、国内の販売市場の拡大にも時間はかかりそうだ。	<政府活動>,<メキシコ>,<その他>
争点はインド政府が2月25日に突然発表し、5月26日に発効させた新しい「2021年IT規則」だ。	<企業活動背景>,<インド>,<法整備・規制>,<施行>
同規則は、SNSなどオンラインプラットフォームへの第三者による投稿の内容について、政府が「違法」と認定すれば裁判抜きに削除を命令できるとした。	<企業活動背景>,<日本>,<法整備・規制>
農林水産省が22日発表した食品価格動向調査によると、6月14日の週は調査対象の8品目のうちレタスやキュウリなど4品目の小売価格が前週比で値下がりした。	<政府活動>,<日本>,<指数・統計>
日本公認会計士協会の手塚正彦会長は22日の記者会見で、東芝の2020年の株主総会の運営に経済産業省が介入したとされる問題について「事実なら非常に由々しき問題」と指摘した。	
厚生労働省の有識者検討会は22日、人工知能などの新技術を導入する場合に、労使のコミュニケーションが重要になると明記した報告書をまとめた。	<政府活動>,<日本>,<法整備・規制>
不法残留している外国人を配達員として雇い、不法就労を助長したとして、警視庁は22日、料理宅配最大手「ウーバーイーツ」を運営する日本法人の代表ら2人と、法人としての同社を入管難民法違反の疑いで書類送検した。	<政府活動>,<日本>,<法整備・規制>
政府が脱炭素を推進し、関連ビジネスが拡大するとみて体制を強化する。	<企業活動背景>,<日本>,<法整備・規制>
オーストラリアで進む大規模な水素製造事業について、豪連邦政府が環境への懸念から事業を進めるための認可を出さなかったことが21日わかった。	<政府活動>,<オーストラリア>,<法整備・規制>
計画は2020年に政府が国家的に重要な意義を持つ「主要プロジェクト」として認定していた。	<企業活動背景>,<日本>,<法整備・規制>
経済産業省は21日、原子力発電所8基が立地する福井県で、原発依存低減に向けた新産業を地元自治体と検討する会議を開いた。	<政府活動>,<日本>,<国際会議・会合・会談>
政府が提供する米モデルナ製ワクチンを使う。	<政府活動>,<日本>,<目標・計画・指針>
金融庁は18日、コインベースを改正資金決済法に基づく暗号資産交換業者として登録したと発表した。	<政府活動>,<日本>,<その他>
金融庁と東京証券取引所が6月に改訂したコーポレートガバナンス・コードに、知的財産の活用などを促す内容が加わった。	<政府活動>,<日本>,<法整備・規制>,<改正>
総務省は18日、全国の高等専門学校生から提案を募った「高専ワイヤレスIoTコンテスト」に2021年度は12件を採択したと発表した。	<政府活動>,<日本>,<法整備・規制>
経済産業省は18日、全国の中小企業のキャッシュレス決済の導入状況に関する調査結果を公表した。	<政府活動>,<日本>,<その他>
農林水産省は18日、2020年産米の5月分の相対取引価格を発表した。	<政府活動>,<日本>,<その他>
30年度の温暖化ガス排出量を13年度に比べて46%削減する目標を政府が4月に決めたことに対応する。	<企業活動背景>,<日本>,<目標・計画・指針>
7月に設立される仙台村田製作所の社長に就任予定の橋本省吾氏は、同拠点で生産する電子部品の生産量を2022年度中に1割増やす方針を示した。	
米政府が国内市場から中国製の通信機器を徹底的に排除する。	<政府活動>,<米国>,<法整備・規制>
政府と取引がない民間企業にも販売できないようにして「抜け穴」を封じる。	
農林水産省はITで農作業を効率化する「スマート農業」の普及に向けた技術情報の一元化に着手する。	<政府活動>,<日本>,<その他>
政府は25年に4割を目指しているが、主要各国では既に4~6割台で、普及は遅れている。	<企業活動背景>,<日本>,<目標・計画・指針>
主要7カ国首脳会議の合意を受け、日本政府は石炭火力発電の輸出支援を年内にやめる。	<政府活動>,<日本>,<法整備・規制>,<廃止>
国土交通省が資源活用を促しており、企業が地方自治体と共同で事業化するケースが増えている。	<政府活動>,<日本>,<指数・統計>
「携帯電話料金値下げ」を目玉政策に掲げる菅義偉政権が2020年9月に誕生して以降、キャリアに対する政府からの値下げ圧力が強まった。	
政府が医療用と一般用のマスクについて性能の目安となる日本産業規格を定めたことを受けて、アイリスオーヤマは生産する全製品を22日に申請すると発表した。	<企業活動背景>,<日本>,<法整備・規制>
経済産業省は17日、社員の健康に配慮した経営をしている441社の評価内容を公表した。	<政府活動>,<日本>,<その他>
政府は21日以降、北海道を緊急事態宣言に準じた対策が可能となる「まん延防止等重点措置」の対象とする方針だ。	<政府活動>,<日本>,<目標・計画・指針>
政府が掲げた「2050年に温暖化ガス排出実質ゼロ」の目標達成に向け、地熱発電の利用を促す技術開発が進む。	<企業活動背景>,<日本>,<目標・計画・指針>
駆動モーターの開発拠点として稼働した江蘇省蘇州市では、2022年3月までに現在の約5割増の250人に増やす。	
モーターの新工場が6月から本格稼働した遼寧省大連市では、既存工場と合わせて4割増の5000人規模にする。	
米商務省が16日発表した5月の住宅着工件数は、前月比3.6%増の157万2千戸だった。	<政府活動>,<米国>,<指数・統計>
資源エネルギー庁が16日発表した14日時点のレギュラーガソリンの店頭価格は前週比1.6円上昇し、1リットル154.5円だった。	<政府活動>,<日本>,<指数・統計>
厚生労働省は16日、新型コロナウイルス感染症の後遺症に関する実態調査の結果を発表した。	<政府活動>,<日本>,<その他>
天候に左右されにくい省人化の大規模工場が普及すれば、デジタル化が遅れる農業の「カイゼン」になる。	
政府は5月にアストラゼネカ製を承認し、3000万回分を海外へ出荷する方針を明らかにしている。	<政府活動>,<日本>,<法整備・規制>
農林水産省が15日に発表した食品価格動向調査によると、6月7日の週では調査対象の8品目のうち4品目が平年比で値下がりした。	<政府活動>,<日本>,<指数・統計>
独政府の「経済安定化ファンド」が議決権を持たない「サイレントパーティシペーション」方式で注入した公的資金の返済にあてるほか、資本構造の強化にもつなげる。	
総務省の有識者会議は14日、携帯電話事業者に割り当てた周波数帯について、ほかの事業者が利用を希望する場合などに再配分できる仕組みを求める報告書案をまとめた。	<政府活動>,<日本>,<法整備・規制>
総務省は14日、放送事業者に対する外資規制の審査強化に向けた有識者会議の初会合を開いた。	<政府活動>,<日本>,<国際会議・会合・会談>
東芝の臨時株主総会で選任された弁護士がまとめた報告書は、東芝と経済産業省が一体となって株主提案権の行使を妨げようと画策し、一部の海外株主に不当な圧力をかけていたと結論づけました。	<政府活動>,<日本>,<法整備・規制>
かたや、経産省は日本の企業統治改革の旗振り役です。	
金融庁は参入に半年から1年程度かかっていた行政手続きを大幅に短縮する。	<政府活動>,<日本>,<法整備・規制>,<改正>
東芝の株主総会に経済産業省が介入した疑いが生じている問題は、政府が海外からの民間投資にどこまで関与できるのかという論点を浮かび上がらせた。	
実験は国土交通省が進める次世代交通サービス「MaaS」の推進・支援事業に選ばれている。	<企業活動背景>,<日本>,<目標・計画・指針>
米農務省が10日発表した6月の需給報告で、2020~21年度の米国産の期末在庫見通しを2812万トンと前月から下方修正した。	<政府活動>,<米国>,<指数・統計>
金融庁が2015年に金融商品取引法改正などで解禁した。	<政府活動>,<日本>,<法整備・規制>
政府は11日、日本製のステンレス製品に対する中国の反ダンピング課税について、世界貿易機関協定に基づく2国間の協議を要請した。	<政府活動>,<日本>,<税制・予算>
日本政府観光局の清野智理事長は日本経済新聞のインタビューに応じ、新型コロナウイルスの感染拡大の前に政府が掲げた「2030年に訪日外国人6000万人」の目標を巡り「ワクチン接種のスピードが上がって国内の受け入れ体制が整えば、現時点でも実現可能だ」との認識を示した。	<政府活動>,<日本>,<指数・統計>
政府が定める接種期間が延長された場合は延長する。	
経産省が一企業の総会運営に関与したとすれば、日本企業の企業統治が問われる事態となる。	<政府活動>,<日本>,<その他>
この総会では、経済産業省の元参与が東芝の株主に対し、議決権を行使しないよう圧力をかけたとの疑いが指摘されていた。	
世界3位の潜在量を持ちながら原子力優先で出遅れた日本も、政府が2030年に発電所を倍増させる方針を掲げ、にわかに「地殻変動」が起きている。	<政府活動>,<日本>,<目標・計画・指針>
新型コロナウイルスのワクチン普及に伴う経済再開や政府の景気刺激策などが消費活動を押し上げているという。	
米製薬大手メルクは9日、開発中の新型コロナウイルス治療薬170万回分について、米国政府が12億ドルで購入すると合意したと発表した。	<政府活動>,<米国>,<補助金・交付金>
政府が策定する次期エネルギー基本計画で、2030年に再エネの発電比率を40%超とする目標設定を改めて求めた。	<政府活動>,<日本>,<法整備・規制>
環境、厚生労働、国土交通の各省や金融庁などの政府系サイトが一時的に閲覧できなくなったと言及した。	<政府活動>,<日本>,<その他>
8日に起きた米fastlyによる世界的な大規模システム障害で、ウェブサイトの閲覧不能や取引の一時停止に見舞われた企業や政府機関のサイトは数千件に上った。	
米労働省が8日発表した4月の雇用動態調査によると、非農業部門の求人件数は、前月から99万8000件増の928万6000件となり、前月に続き統計開始の2000年12月以来最高を更新した。	<政府活動>,<米国>,<指数・統計>
政府が実現を目指す50年の「カーボンニュートラル」を追い風に、家庭での「オール電化」を加速させる。	<企業活動背景>,<日本>,<目標・計画・指針>
政府は8日、2021年版の科学技術・イノベーション白書を決定した。	<政府活動>,<日本>,<目標・計画・指針>
職場や大学での新型コロナウイルスワクチンの接種について、政府への申請が8日始まった。	
冒頭に総務省の竹内芳明総合通信基盤局長は「ポスト・ニューノーマルでは、デジタル化とグリーン化が成長のカギになる」と述べた。	<政府活動>,<日本>,<その他>
米司法省は7日、米東海岸の燃料パイプラインがランサムウエアによる攻撃を受けて停止した問題で、犯行グループに支払われた身代金の大部分を奪還したと発表した。	<政府活動>,<米国>,<その他>
機械設計・省力化機器製造のジータは部品などの仕分け作業を支援するシステムを開発した。	
安価な省力化システムとして、完全自動化などの大規模投資が難しい企業向けに売り込む。	
経済産業省の幹部は「1年越しのラブコールだった。もう小林さんしかいないんだ」と胸をなで下ろした。	
政府が脱炭素社会の目標を掲げる中でEVなどの需要増加を見込み、環境対応のサービスを拡充する。	<企業活動背景>,<日本>,<目標・計画・指針>
工場の自動化・省力化ニーズが伸びている。	
特別調査委員会がまとめた報告書によると、NTTデータの幹部と総務省幹部職員との会食は2019年11月と20年7月の2回。	<政府活動>,<日本>,<指数・統計>
政府が掲げる2050年までに温暖化ガス排出量を実質ゼロにする目標の達成に貢献できると期待している。	<企業活動背景>,<日本>,<その他>
日本経済新聞社と総務省が主催する「世界デジタルサミット2021」が7日開幕した。	<企業活動背景>,<日本>,<その他>
世界で脱炭素の機運が高まるなか、日本政府も温暖化ガスの削減目標を打ち出した。	<政府活動>,<日本>,<目標・計画・指針>
富士通の情報共有ツールに外部から不正アクセスがあり外務省や国土交通省などの個人情報が流出した問題で、東京五輪・パラリンピック組織委員会の個人情報も漏れていたことが4日、関係者への取材で分かった。	
組織委のほか、中央省庁、東京都や福島県といった会場となる地方自治体、スポンサー企業を含む約90組織のセキュリティー担当者ら約170人の情報が漏えいした。	
政府が配布する米モデルナ製ワクチンを21日以降に接種する。	
ワクチンの職域接種を開始する政府方針に協力する。	<政府活動>,<日本>,<その他>
政府が職場などでの「職域接種」を可能とする方針を示したことを受けて協力する。	<企業活動背景>,<日本>,<目標・計画・指針>
経済産業省は温暖化ガス排出量の多い業種別に脱炭素に向けた工程表を策定する。	<政府活動>,<日本>,<目標・計画・指針>
米司法省がトランプ前政権下で米紙ニューヨーク・タイムズの記者4人の通話記録を極秘に入手していたことが3日までに分かった。	<政府活動>,<米国>,<その他>
通話記録の入手は米司法省が同紙に連絡を入れ、判明した。	<政府活動>,<米国>,<目標・計画・指針>
政府が2日、職場接種を可能とする方針を示したことを受けた対応。	<企業活動背景>,<日本>,<目標・計画・指針>
新型コロナウイルスのワクチンを職場で接種するよう政府が促していることを受け、九州・沖縄でも主な大手企業が検討を始めた。	<企業活動背景>,<日本>,<法整備・規制>,<検討>
経済産業省が近くまとめるデジタル産業についての新戦略が明らかになった。	<企業活動背景>,<日本>,<その他>
政府が2050年に温暖化ガスの排出を実質ゼロにする方針を掲げたのを受け、脱炭素対策に取り組む企業が増えているのに対応する。	<政府活動>,<日本>,<指数・統計>
原料となる輸入小麦の政府売り渡し価格が引き上げられたことに加え、物流費や包装費なども上昇しているため。	
政府は3日、脱炭素社会の実現に向けた住宅・建築物の対策案を示した。	<政府活動>,<日本>,<目標・計画・指針>
流出したのは、NISCが富士通に開発や運営を委託する情報システムの機器情報のほか、同センターが実施する訓練に参加した政府や企業約90組織、約170人分の役職や氏名といった情報だ。	
ただ政府が出資することで、報道の独立性が大きく揺らぐ懸念も強まる。	<企業活動背景>,<日本>,<補助金・交付金>
新型コロナウイルスのワクチンを職場で接種するよう政府が促していることを受け、関西で検討する企業が増えている。	<企業活動背景>,<日本>,<指数・統計>
資源エネルギー庁が2日発表した5月31日時点のレギュラーガソリンの店頭価格は前週比0.1円値下がりし、1リットル152.5円だった。	<政府活動>,<日本>,<指数・統計>
内閣サイバーセキュリティセンターは2日、富士通の情報共有システムへの不正アクセスに絡み、同センターが実施したサイバーセキュリティーに関する訓練に参加した政府や民間企業約90組織、約170人分の役職、氏名などの個人情報が流出したと発表した。	<政府活動>,<日本>,<その他>
総務省は2日、高速通信規格「5G」の基地局整備が遅れているとして、ソフトバンクを電波法に基づき行政指導した。	<政府活動>,<日本>,<法整備・規制>
総務省は4G用に割り当てた電波の5G転用を認めている。	<政府活動>,<日本>,<法整備・規制>
総務省は21年中に不足分を解消するよう求めた。	<政府活動>,<日本>,<法整備・規制>
政府は2日、月内に決める成長戦略の原案を公表した。	<政府活動>,<日本>,<目標・計画・指針>
香港政府は2050年までに二酸化炭素などの温暖化ガスの排出を実質ゼロにする「カーボンニュートラル」を目指す方針を決めた。	<政府活動>,<香港>,<目標・計画・指針>
--香港政府がカーボンニュートラルの目標を発表しました。	<政府活動>,<香港>,<目標・計画・指針>
政府が新型コロナウイルスのワクチンに関し、高齢者向けの確保にめどがついたとみて12~64歳の一般向け接種に本格的に着手する。	<政府活動>,<日本>,<目標・計画・指針>
米連邦捜査局が捜査に着手し、米農務省は他の加工業者と協議して食肉供給への影響を調べている。	<政府活動>,<米国>,<法整備・規制>,<検討>
政府はトラックなどの小型商用車の新車販売を2040年までに全て電気自動車や燃料電池車といった電動車などに切り替える目標を設ける。	<政府活動>,<日本>,<目標・計画・指針>
北陸電力と富山市は2019年にSDGsについて連携協定を結んでおり、共同でエネルギーの地産地消を推し進め、50年までに温暖化ガス排出量を実質ゼロにする政府の方針に対応する。	<企業活動背景>,<日本>,<目標・計画・指針>
経済産業省は二酸化炭素から都市ガスの原料となるメタンを合成する技術開発を強化する。	<政府活動>,<日本>,<法整備・規制>
政府は1日、国産ワクチンの開発・生産についての国家戦略を閣議で決めた。	<政府活動>,<日本>,<目標・計画・指針>
19年10月の消費増税にあわせた政府のポイント還元事業などを機に日常使いが広がっている。	
日本経済新聞社と総務省は6月7、8日の2日間、この分野の有力企業トップや専門家を国内外から招いて、「ポスト・ニューノーマル~レジリエントな社会を目指して」をテーマに「世界デジタルサミット2021」を開催、ネット配信する。	<政府活動>,<日本>,<国際会議・会合・会談>
政府は1日、ワクチン開発・生産体制を強化する戦略を閣議で決めた。	<政府活動>,<日本>,<目標・計画・指針>
政府は米国で広がった特別買収目的会社「SPAC」の解禁を検討する。	<政府活動>,<日本>,<法整備・規制>
総務省は31日、格安スマートフォン事業者が携帯大手から借りる通話回線の貸出料について、引き下げに向けた制度を整備する方針を示した。	<政府活動>,<日本>,<目標・計画・指針>
産業用素材の過度な高値を警戒する中国政府が立て続けに規制の強化に動いたためだ。	<政府活動>,<中国>,<その他>
2050年に温暖化ガス排出量を実質ゼロにするという政府目標の達成に向け、小さな働き者が切り札になるかもしれない。	
政府は米国で広がった特別買収目的会社「SPAC」の解禁を検討する。	<政府活動>,<日本>,<法整備・規制>
欧州連合で医薬品の審査を担当する欧州医薬品庁は28日、独ビオンテックと米ファイザーが共同開発した新型コロナウイルスワクチンについて、12~15歳への承認を勧告すると発表した。	<政府活動>,<欧州>,<法整備・規制>
欧州委員会が正式に承認したうえで、実際の運用は加盟国の政府がそれぞれ決める。	<政府活動>,<日本>,<法整備・規制>
日本鉄鋼連盟の橋本英二会長は28日記者会見し、政府が2050年に目標を掲げるカーボンニュートラル政策について、「安全が確認された原子力発電設備などを最大限活用する必要がある」と述べた。	<企業活動背景>,<日本>,<目標・計画・指針>
総務省は28日、携帯会社が自社の回線契約でしか端末を使えないようにするSIMロックを巡り、10月1日から原則禁止する方針を示した。	<政府活動>,<日本>,<法整備・規制>
民間人材を活用しながら、県庁内はもとより、県民生活の質向上や産業活性化にもつなげる。	
政府は電気自動車やハイブリッド車向けの急速充電器を2030年をめどに現在の約4倍の3万基まで増やす。	<政府活動>,<日本>,<目標・計画・指針>
総務省は携帯大手が販売代理店に支払う手数料体系などが不適切な営業行為を助長していると判断した場合、携帯大手に業務改善命令を出せるようにする。	<政府活動>,<日本>,<法整備・規制>
実証は政府系のタイ発電公社が中心となり、12月から2022年12月までする予定だ。	
厚生労働省が28日発表した2020年度の毎月勤労統計調査によると、1人あたりの現金給与総額は月平均で31万8081円だった。	<政府活動>,<日本>,<指数・統計>
「米国政府が収益を吸い上げようとしている。税金はグーグルから取るべきで、私たちからではない」。	
総務省が28日、情報通信行政・郵政行政審議会にNTT東西の契約約款の変更認可を諮問する。	<政府活動>,<日本>,<法整備・規制>,<検討>
日本新聞協会は27日、巨大IT企業の規制新法の対象にインターネット広告を加えるとした政府の最終報告への意見書を提出した。	
実態が不透明だと指摘されるネット広告取引の改善に向け、新法が促すIT企業の対応を政府が点検することを通じ、規制に実効性を持たせるよう求めた。	
放送法に基づく外資規制に違反していた企業や、総務省幹部の接待問題が表面化し、野党が審議入りに反発してきた。	
政府が洋上風力の導入を促進する海域に指定する秋田県沖や千葉県沖では、風力発電の開発事業者が参入方針を打ち出している。	<企業活動背景>,<日本>,<目標・計画・指針>
政府は2019年4月、洋上風力の導入を促進する「再エネ海域利用法」を施行した。	<政府活動>,<日本>,<法整備・規制>,<施行>
総務省は5月25日、世界6都市の携帯電話料金などを比較した「電気通信サービスに係る内外価格差調査」の2020年度の調査結果を発表した。	<政府活動>,<日本>,<その他>
新型コロナウイルスの感染拡大が長期化し、政府が5月31日までとする9都道府県の緊急事態宣言は延長が検討されている。	<政府活動>,<日本>,<その他>
経済産業省などは企業が削減した温暖化ガス排出量を売買できる制度の対象に水素活用分を追加する。	<政府活動>,<日本>,<法整備・規制>,<改正>
経産省、環境省、農林水産省が2013年度から始めた国内向け売買制度「J-クレジット」を見直す。	<企業活動背景>,<日本>,<法整備・規制>,<検討>,<改正>
