「GumGum」と連携し、クッキーに依存しないコンテクスチュアル・ターゲティングの提供を開始:時事ドットコム、Webコンテンツの文脈に合わせた高精度なターゲット設定で質の高い広告配信を実現大日本印刷株式会社はGumGum Japan株式会社と協業し、Webページの画像と文章をAIが自動解析することで、Webページの内容に最適な広告を選んで配信するサービス「GumGumターゲティング」を、DNP独自の広告取引経済圏「DNP Marketplace」に組み込んで提供開始します。	製品化・サービス化
パナソニック サイクルテック株式会社は、幼児2人同乗用自転車の基準1に適合した電動アシスト自転車ギュットシリーズの新モデルとして、大容量12Ahバッテリーを搭載したギュット・ミニ・DXとギュット・DXを7月2日に発売します。	製品化・サービス化
コンテンツシードは、2022年3月10日より、ウェブポンとくじメイトにて「.HACK//G.U. LAST RECODE」のオンラインくじを販売する。	製品化・サービス化
瀧口、浩平)は、新しい患者体験の提供と業務効率の向上をめざした歯科向けのクラウド業務支援システム「Dentis」の提供を開始します。	製品化・サービス化
フードデリバリー大手の「Wolt」を展開するウォルトジャパンの関連会社「ウォルトマーケットジャパン」は27日午前9時半から、食料品や日用品など約2000品目を注文から30分程度で届ける配達サービスを函館市内で開始する。	製品化・サービス化
日本の電機メーカー、パナソニックが電気自動車の走行距離を最大20%延ばすことができる次世代のリチウムイオン電池「4680」を量産する。	製品化・サービス化
セブンイレブンが、「まんぷく、肉盛りコンボ」を2022年2月15日以降順次発売しています。	製品化・サービス化
株式会社グローバルインフォメーションは、市場調査レポート「採血装置の世界市場」の販売を2022年3月1日より開始いたしました。	製品化・サービス化
dooooはセントチヒロ・チッチの口をモチーフにした"人肉アート"を制作。	製品化・サービス化
AIによる不動産情報提供サービス「Dr.Asset、レコメンダー」を運営するエステートテクノロジーズ株式会社は、株式会社MFSが運営するオンライン不動産投資サービス「INVASE」とサービス連携し、INVASE会員へ物件情報の提供を開始しました。	製品化・サービス化
ドリームファクトリーはドクターエアブランドより、コードレスネックマッサージャーの新モデル「3Dネックマッサージャープレミアム、MN-05」を2月9日に発売した。	製品化・サービス化
NTTドコモとauは、Nreal Ltd.が開発したARグラス「Nreal Air」を2022年3月4日に発売する。	製品化・サービス化
エコラボはこのロボットを医療分野の顧客向けに取り扱う。	製品化・サービス化
花嫁アプリ「PLACOLE & DRESSY」を運営する、冒険社プラコレは、コロナ禍で結婚準備をすすめる花嫁に対して「特別な時代を過ごす花嫁へ」DRESSYが贈る、特別コンテンツをスタート。	製品化・サービス化
パナソニック株式会社、エコソリューションズ社は、独自の耐震住宅工法「テクノストラクチャー」の提案力強化のため、3階建て住宅用と平屋住宅用のプランをリニューアル。	製品化・サービス化
英国防省は9日、ロシアが燃料気化爆弾を搭載したロケット弾を多連装で発射できるランチャー「TOS1A」兵器システムを使用したと発表した。	製品化・サービス化
2月2日、アイロボットジャパンは新型ロボット掃除機、「ルンバ、j7+」、「ルンバ、j7」、を発表。	製品化・サービス化
:時事ドットコム サントリー食品インターナショナル株式会社は、"働く人の相棒"「BOSS」より缶コーヒーの新商品「ボス オールスター」を2月1日に発売します。	製品化・サービス化
化粧品・美容家電等の企画開発・販売事業を展開するBOURGEON株式会社は、応援購入サービス「Makuake」でプロジェクト「サラ髪、艶感。プロが追求した美髪ヘアオイル。」をスタートした。	研究・開発
パナソニック株式会社は、グランフロント大阪、南館内に展開する、お客様と共に新しい価値を生み出すショウルーム「パナソニックセンター大阪」の2階「LIFE STYLE Floor」にあるセルフエステ&パウダールームCLUXTAにおいて、2014年11月21日から、関西で唯一、Panasonic Beauty PREMIUMシリーズ3機種をじっくりお試しいただける「PREMIUMセルフエステコース」がスタートいたします。	製品化・サービス化
ライフスタイルツールwith Speaker、ナカバヤシは、紙箱型収納用品「LIFESTYLE TOOL」シリーズの新製品として、スピーカーを搭載した「ライフスタイルツールwith Speaker」を3月中旬に発売する。	製品化・サービス化
日本ルナ株式会社は、ロングセラー商品「バニラヨーグルト」の味わいをそのままドリンクタイプに仕上げた「のむバニラヨーグルト」を、2022年3月21日より全国で新発売します。	製品化・サービス化
KDDIと沖縄セルラーは、オンライン専用料金プラン「povo2.0」の新CMを放映開始した。	その他
オリオンビールは2月28日、30歳以上の従業員を対象とした早期退職制度「セカンドキャリアサポートプログラム」の実施を発表した。	製品化・サービス化
テクトロニック インダストリーズ カンパニー リミテッドが設立した、ミルウォーキーツール・ジャパン合同会社はツールボックス「PACKOUTTMシリーズ」に新たに6商品をラインアップ。	製品化・サービス化
ラキールは、貿易業務の完全電子化を目指してNTTデータら10社が共同出資するトレードワルツが「LaKeel DX」を導入すると発表した。	製品化・サービス化
奈良県広陵町の靴下メーカー「創喜」が、自転車をこいで靴下を編める機械を作り、自社の敷地内に体験施設「S.Labo」を開いた。	製品化・サービス化
月々330円で利用できる"サブスク型"電動歯ブラシサービス「dentaly」が、2月1日よりスタートした。	製品化・サービス化
セコム株式会社は、商業施設やオフィスビルなどさまざまな場所に調和しながらAI・5Gなどの最先端技術を活用して警備業務を行うセキュリティロボット「cocobo」を、2022年1月17日に発売する。	製品化・サービス化
レイングッズブランド「ダブリュピーシー」が、フラワーアート・ユニット「プランティカ」とコラボレーションした「フラワーアンブレラプラスティック」シリーズの新作を発売した。	製品化・サービス化
フューチャーセルジャパン株式会社は、東京大学大学院医学系研究科疾患生命工学センター・健康環境医工学と共同研究を開始しました。	研究・開発
株式会社TKCは若手社員の育成を目的に、スキルアップAI株式会社の協力を得て、AIの基礎知識や活用方法を学ぶ社内研修を1月19日から開始します。	研究・開発
パナソニック株式会社、エコソリューションズ社は、年間の一次エネルギー消費量が正味で概ねゼロとなるネット・ゼロ・エネルギー・ハウスに、安心・健康に配慮した「ウェルネス」の要素を加えた新しいゼロエネルギーの住まい「スマートウェルネス住宅」3タイプを、2015年7月1日よりパナソニックビルダーズグループ加盟店にて販売します。	製品化・サービス化
パナソニック コンシューマーマーケティング株式会社はWeb上で運営するパナソニック製品の直販サイトCLUB Panasonic My MALL、にて、50種類のオリジナルデザイン1のデジタルカメラの販売を開始します。	製品化・サービス化
逗子市逗子の亀岡八幡宮で、名前にちなみウミガメをモチーフにしたカラフルなお守りを販売している。	製品化・サービス化
採用に特化したFAQ型チャットボット、「TalkQA for Recruit」を6月末まで無料で提供!:時事ドットコム、~、今がチャンス!最短5営業日で採用ページにチャットボットを無料で導入!~エクスウェア株式会社はAIによる新卒採用に特化したチャットボットサービス「TalkQA for Recruit」を1月24日、から、6月30日まで、無料で提供します。	製品化・サービス化
ソフト99コーポレーションは1日、ガラス撥水材「ガラコ」シリーズから、シリーズ史上最高の視界を実現する「ぬりぬりガラコDX」を発売した。	製品化・サービス化
株式会社日立製作所、SBテクノロジー株式会社、国立大学法人東京大学、日本電気株式会社、富士通株式会社、大学共同利用機関法人、情報・システム研究機構、国立情報学研究所、株式会社NTTデータ、JIPテクノサイエンス株式会社の8団体は28日、「ビッグデータ・AIを活用したサイバー空間基盤技術」の研究開発において、分散型の分野間データ連携基盤技術を開発し、社会実装に向けて実証を開始したと発表した。	研究・開発
詳しくはこちら明光ネットワークジャパンは海外人材支援のORJと連携して、技能実習生や特定技能人材に向けた日本語教育サービスを提供する。	製品化・サービス化
日本初のマドレーヌ専門店<マドレーヌラパン>を運営する株式会社キルンは、2022年1月24日12時よりデコレーションマドレーヌ「くまさんのミニマド」を、自社オンラインショップ完全受注生産にて販売します。	製品化・サービス化
ホンダ車専門のチューニングショップ"ゼロファイターオートカスタム"から、EKシビック用の「純正形状アウタードアハンドル」が発売された。	製品化・サービス化
ゲームセンターやテーマパークなどのアミューズメント施設を全国に展開するバンダイナムコアミューズメントは、「遊び」の本質を見つめ常に時代に先駆けたさまざまなアミューズメント機器やアミューズメント施設の企画・開発・運営に取り組んでいます。	製品化・サービス化
保育園向け「食育研修プログラム」のオンライン提供開始、栄養士・保育士の食育スキル向上を支援し、園のブランディングに寄与:時事ドットコム、~園に合った食育活動を知り子どもの好奇心を高める~ICTで保育士の働き方改革や保育業界のDXを推進し、子どもの幸せをつくることを目指す千株式会社と、「給食食材配達・食育サービス」を提供する株式会社ベジリンクは、子どもが健康で幸せな毎日を過ごせるように保育園向けに安心安全な給食食材の提供と、豊富な食育プログラムの提供を行っています。	製品化・サービス化
将来、実用化が期待される先端技術の情報を提供する沖為工作室合同会社は市場調査分析レポート「車載インテリアセンサーマーケットトレンド、-2022版」の販売を2021年12月24日より開始いたしました。	製品化・サービス化
フェリシモが展開する「フェリシモミュージアム部」は、「太宰治と中原中也の逸話より"空に浮かんだ青鯖"の缶詰風ポーチ」のウェブ販売を2月22日より開始しています。	製品化・サービス化
豊中市は、学校の統廃合などで使われなくなったピアノを子どもたちがペイントし、誰でも自由に弾いてもらえるよう市内を巡回させる「ストリートピアノプロジェクト」を展開している。	製品化・サービス化
旭川かわまちづくり計画検討・推進会議は、岡山後楽園・岡山城を中心とする水辺空間を活用する社会実験として「おかやま旭川遊覧クルーズ」を3月18日に開始する。	製品化・サービス化
日本発のショートムービー機能を搭載したライブコマースアプリ「POPO」を運営する株式会社ポポホールディングスは、プロレーシングドライバー・塚本奈々美とのコラボレーションにより、2021年1月14日から1月16日にかけて開催される東京オートサロン2022にてライブコマースを実施します。	製品化・サービス化
ヤマハ株式会社は、小・中規模の会議室やオープンスペースなど、オフィスのさまざまな環境で利用可能なUSB接続型のスピーカーフォン「YVC-331」を発表した。	その他
金属表面処理や金型・部品製造などの中日クラフトは、レーザークリーナー装置の販売を強化する。	製品化・サービス化
ザ・サウザンド キョウトでは、いちご尽くしの期間限定アフタヌーンティーセット「Strawberry Afternoon Tea ~自分へのご褒美、Luxury Time~」を、2022年1月8日から5月8日までの期間で提供する。	製品化・サービス化
東京・秋葉原地域で使えるコミュニティ通貨サービスが、「アキコ」として1月26日からサービスを開始する。	製品化・サービス化
パイオニアは、映像コンテンツや地図をHD解像度の高画質で表示し、使いやすいインターフェースを採用したHDパネル搭載高画質モデル12機種と、コストパフォーマンスに優れたワンセグモデル2機種の「楽ナビ」計14機種を発売します。	製品化・サービス化
スイス発チョコレートブランド「リンツ」は、日本各地を移動するリンツ ショコラブティック&カフェ「ハートフル ワゴン」を2022年1月21日からバレンタインの期間限定でスタートします。	製品化・サービス化
ソウルドアウトは、地方を含む日本全国の中小・ベンチャー企業の成長支援をデジタルマーケティング領域で展開する企業。	製品化・サービス化
:時事ドットコム、、アース製薬株式会社は、2月1日、MA-Tシステムを活用した医科歯科専売の口腔ケア用品「N.actオーラルリムーバルジェル」を発売します。	製品化・サービス化
株式会社、KRAFTONは「PUBG: BATTLEGROUNDS」の無料プレイサービス後のユーザーゲームプレイトレンドを発表しました。	製品化・サービス化
アルプスアルパイン、空中表示・操作できるディスプレー アルプスアルパインは18日、宇都宮大学と共同で空中にディスプレー画面などの映像を表示し、非接触で操作できる技術を開発したと発表した。	研究・開発
凸版印刷は2月21日、ビジネス向けのメタバースサービス基盤「MiraVerse」を4月から提供開始する、と発表した。	製品化・サービス化
きょうから米ラスベガスで世界最大のテクノロジー見本市「CES2022」が開催されているが、同社はプロセッサーやグラフィック用チップの新製品を発表している。	製品化・サービス化
現在のトヨタ自動車の社長である豊田章男氏の曾祖父にあたる豊田佐吉氏は、1890年に豊田式木製人力織機を発明し特許を取得。	製品化・サービス化
パナソニック株式会社、エコソリューションズ社は、「建築に自由を与える。」をコンセプトとして展開している建築照明器具、SmartArchiシリーズの「ソフトライト」合計32品番を2013年7月1日より発売します。	製品化・サービス化
パナソニックの子会社Shiftallは4日、VRヘッドセット「MeganeX」などメタバース向け製品3種を発売すると発表した。	製品化・サービス化
JR東日本は、日立製作所およびDX Cテクノロジー・ジャパンとともに「タクシー乗り場需要の可視化による交通行動の最適化実証」を東京駅で実施する。	研究・開発
フォルクスワーゲングループジャパンは1月21日、SUVタイプの新型電気自動車「ID.4」を2022年中に日本市場に投入すると発表した。	製品化・サービス化
Toge Productionsはメカジオラマ構築ツール「KRIEGSFRONT BATTLESCAPER - DIORAMA EDITOR」のデモ版を公開しました。	製品化・サービス化
東芝デジタルソリューションズは2022年3月7日、情報漏洩対策サービス「ZENMU Virtual Drive」の販売を開始した。	製品化・サービス化
酒類業界もこれに合わせて少容量製品を発売している。	製品化・サービス化
AMDは3日、デスクトップPC向けの次世代CPU「Ryzen 7000」シリーズプロセッサを発表した。	製品化・サービス化
柳谷聖苑は、全国に向けた自然葬の新しい墓「花手水葬」の第一期の販売をスタートしました。	製品化・サービス化
東京海上日動火災保険株式会社は、デジタルコンテンツを活用した保険のニーズ喚起やデータを活用したマーケティング活動のDXに向けた取り組みとして、保険代理店向けデジタルマーケティングプラットフォームの提供を開始します。	製品化・サービス化
農林水産の事業者向けにも貸付制度をスタートする。	製品化・サービス化
株式会社千葉ステーションビルはTVアニメ「やはり俺の青春ラブコメはまちがっている。完」とコラボしたグルメラリーイベントを実施します。	製品化・サービス化
NTT東日本は1月24日、ビオストックとともに、都市型循環エコシステムの実証を行うと発表した。	研究・開発
X-LEGEND ENTERTAINMENTは、スマートフォン向け新作MMORPG「スプライトファンタジア、-精霊物語-」を2022年春に配信することを発表しました。	製品化・サービス化
シャープは、本社所在地がある大阪府堺市堺区役所と共同で、窓口業務用マイク搭載スピーカーシステム<GX-CS100>を活用した窓口業務における効率改善効果の実証実験を、本年3月7日から18日まで実施します。	研究・開発
今後「アスレタ」とキーズは共同で、アイテムの製作、助成金プログラムのローンチ、独自のコミュニティコンテンツを通じた女性のエンパワーメントに取り組む。	
人気ARゲーム「Pokemon GO」などを手掛ける米Nianticは2021年11月8日、ARアプリ開発者向けの開発キット「Niantic Lightship AR Developer Kit」を公開した。	研究・開発
永大産業株式会社では、12月27日から「セーフケアプラス、大開口間仕切り吊り戸」を発売いたします。	製品化・サービス化
愛知製鋼は10日、2021年1月に技術実証した毎分3万4000回転の小型軽量モーターを一般製品比50%に小型化し、新開発の小型高減速機と組み合わせ一体化した、高速回転・高減速の次世代電動アクスルの技術実証に世界で初めて成功したと発表した。	研究・開発
株式会社ワーカービーは、2022年1月28日よりブラウザで簡単に遊べるゲーム「マーブルガーデン」をヤフー株式会社が運営するゲームポータルサイト「Yahoo!ゲーム」内の「かんたんゲーム」に提供を開始いたしました。	製品化・サービス化
2030年の実用化めざす、JR東日本は18日、水素をエネルギー源としたハイブリッド電車の試験車両FVE991系「HYBARI」を横浜支社鎌倉車両センター中原支所で報道公開した。	その他
HACCIは、"桜のはちみつ"「テーブルハニー、国産、桜」を2022年2月18日より数量限定で発売する。	製品化・サービス化
極洋は20日、25年から国産陸上養殖サーモンを同社として初めて販売すると発表した。	製品化・サービス化
パーソルプロセス&テクノロジー株式会社は、マイクロソフトのERPソフト「Dynamics AX」を利用する顧客を対象に提供している、Dynamics 365への移行支援サービスを、新体制で提供すると発表した。	製品化・サービス化
トラストバンクは、自社が提供する自治体向け地域通貨プラットフォームサービス「chiica」において、セブン銀行ATMでの現金チャージが可能となったことを、2022年1月4日に発表した。	その他
静岡トヨタは、静岡県西部地域の販売拠点の整備に乗り出す。	その他
留学事業を手掛ける株式会社アフィニティは、GJJ海外就職デスクと協力し、海外就職を目指す国内外の新卒大学生を対象とした海外就職支援プログラムを2022年1月から開始しました。	その他
コージィコーポレーションは3月18日に、カラフルでポップなDISNEYキャラクターアイテムが揃うディズニーの子ども服専門店「DISNEY POP-UP STORE by BABYDOLL」を、グランツリー武蔵小杉と、ららぽーと柏の葉内に2店舗同時オープンする。	製品化・サービス化
パナソニック株式会社は、これまでIPライセンスを提供してきた高速電力線通信「HD-PLC」に関し、通信速度を現行の最大4倍まで拡張できるスケーラブルな「HD-PLC」IPコアのライセンスを新たに追加して、その提供を10月1日より開始します。	製品化・サービス化
スズキ株式会社は、月額定額で利用できる中古車のサブスクリプションサービス「スズキ定額マイカー」を1月26日より開始します。	製品化・サービス化
コトブキヤは、プラモデル「ジェイデッカー」を1月13日に再販売する。	製品化・サービス化
パナソニック株式会社は、光学12倍ズームレンズを搭載し、さらにiAズームを使えば24倍までズームできる、スリムボディで高倍率のコンパクトデジタルカメラLUMIX DMC-SZ8を3月13日に発売いたします。	製品化・サービス化
株式会社ナビタイムジャパンは、2022年2月9日より、Android OS向けにスピードメーターアプリ「SPEED METER by NAVITIME」を提供開始いたします。	製品化・サービス化
株式会社ティーケーピーは、東京・横浜エリアのTKP会場限定で、会議の後に短時間で軽く歓談することができる、コロナ感染対策をセットにした「リフレッシュ歓談プラン」の販売を開始いたします。	製品化・サービス化
帝人は24日、リサイクル炭素繊維の商業化に向けて、富士加飾と業務提携することで合意したと発表した。	その他
インテリア家電製品および、PCサプライ品の製造販売を手掛ける株式会社ヤザワコーポレーションは、、サーモカメラ&ディスペンサースタンドを発売しました。	製品化・サービス化
寺岡精工は、これまでの対面計量POSレジのPOS機能をさらに進化させ、計量POSでは日本初となるキャッシュレス対応およびデポジット管理機能を可能にした対面計量POSレジ「RM-3800」を、「第56回スーパーマーケット・トレードショー2022」にて先行展示した。	製品化・サービス化
マツダの欧州部門である「Mazda Motor Europe」は9日、クロスオーバーSUVの最新モデル「CX-60」を公開した。	製品化・サービス化
ヌリカエは、「住まいに関する、より多くのよき縁をつくる」というビジョンを掲げ、リフォーム業界の中でも特に市場規模・課題の大きい塗装領域や水回り、解体工事などにおいて、ユーザーとリフォーム会社をつなぐマッチングサービスを提供しています。	製品化・サービス化
モイストクレンジング マセ」をMakuakeにて先行販売開始:時事ドットコム、株式会社シーボンは、ロングセラー製品である高機能クレンジングクリーム"マセ"の技術を応用した進化系メンズスキンケア「XYC、モイストクレンジング マセ」を初の試みとして、「アタラシイものや体験の応援購入サービスMakuake」にて先行販売を開始致します。	製品化・サービス化
