三菱地所は、高速道路ICに直結し、完全自動運転トラックなどに対応した「次世代基幹物流施設」の開発計画を、京都府城陽市東部丘陵地青谷先行整備地区で開始した。	研究・開発
株式会社カヤックはNHK大河ドラマ「鎌倉殿の13人」の放送に合わせて3月1日から開設される「鎌倉殿の13人、大河ドラマ館」のプロモーションとして、ARを活用した「しゃべる肖像画ポスター」を企画・制作したことを発表した。	製品化・サービス化
住宅エンターテインメントブランドLIFE LABELと新しい生活文化をデザインするクリエイティブ総合商社AMADANAが趣味やこだわりを最大限楽しめる住宅「AMADANA BASE PRODUCED BY AMADANA」の共同開発を発表した。	研究・開発
秋田内陸縦貫鉄道や北秋田市商工会など5団体でつくる協議会「やってみよう!北秋田」は、北秋田の星空の魅力を発信する「星空案内人」の養成に取り組んでいる。	その他
スリーアールソリューションは、折りたたみ衣類乾燥機「ぽけどらい、3R-HCD01」の先行販売を2月14日までMakuakeで実施している。	製品化・サービス化
関東にスーパー78店舗を展開するマミーマートは年始に沖縄県産生鮮ビンナガの生食用商品を相次ぎ商品化し、順調に販売を伸ばしている。	製品化・サービス化
国内仮想通貨取引所「Liquid」は2022年2月10日、「イーサリアム・キラー」の代表格として注目を集める仮想通貨ソラナの国内初の取り扱いを開始することを発表しました。	製品化・サービス化
エスビー食品株式会社は、ゆでたスパゲッティにまぜるだけで出来上がる「まぜるだけのスパゲッティソース」シリーズから、「イタリアの恵み、ボロネーゼ」「イタリアの恵み、トマトガーリック」「イタリアの恵み、レモンクリーム」を新発売します。	製品化・サービス化
宇都宮市は今月、119番通報の際、スマートフォンの映像を活用するシステム「Live119」の試験運用を開始した。	研究・開発
旭化成はAI技術などで材料開発の効率を高める手法を導入した。	製品化・サービス化
静岡県袋井市は、地域資源を活かしたシティプロモーションとして、オリジナルストーリーで見せる観光動画と「たのしい・おいしい」情報を詰め込んだ冊子を公開している。	製品化・サービス化
環境に優しい「西宮市指定ごみ袋」12種類を発売!、日本サニパック株式会社は、兵庫県西宮市で2022年4月1日より開始される「指定袋制度」に先立ち、環境に優しい素材を使用した家庭用の「もやすごみ」用と「その他プラ」用、事業系の「可燃ごみ」用のごみ袋12種類を1月24日に発売しました。	製品化・サービス化
SOMPOホールディングスとSOMPOケアは、綜合警備保障およびウチヤマホールディングスの2社とそれぞれ、介護領域のリアルデータを起点とした介護業界の社会課題解決につながるソリューション創出に向けた協業を開始した。	その他
シェアリングエネルギーは11日、太陽光発電のオンサイトPPAサービス「シェアでんき」の蓄電池付きオプションを特別価格で提供するキャンペーンを実施すると発表した。	製品化・サービス化
詳しくはこちらソフトバンクと日本気象協会は1月31日、小売り・飲食業界向けの人工知能需要予測サービス「サキミル」を共同開発したと発表した。	研究・開発
パナソニック株式会社は、「お部屋ジャンプリンク」機能に対応した液晶テレビ「ビエラ」D305シリーズ4機種を8月26日より発売します。	製品化・サービス化
2022年1月6日、未来を切り拓こうとする方々を応援する株式会社メディアインキュベートは、「ライター・編集者の学び合いコミュニティ」をスタートいたしました。	製品化・サービス化
トップゲーム・アニメ、通販サイト大手のAmazonは、同社が展開するオーディオブック販売サービス「Amazon Audible」について、1月27日からオーディオブックの聴き放題サービスを新たに提供すると発表した。	製品化・サービス化
カスカワスポーツは、野球用具の整理整頓に活用できるスポーツ家具「HARUK」の取り扱いを開始した。	製品化・サービス化
多種多様な電子機器に半導体を提供する世界的半導体メーカーで、MEMS製造をけん引するSTマイクロエレクトロニクスは、AIアルゴリズムの実行に最適なデジタル・シグナル・プロセッサとMEMSセンサを1チップに集積したインテリジェント・センサ・プロセッシング・ユニットを発表しました。	製品化・サービス化
パナソニック株式会社デバイス社は、スマートフォンやタブレットPC、ノートPCの本体電源回路部に最適な、当社独自パッケージPMCPを用いた、高放熱かつ超小型、電圧損失の小さい高効率なショットキバリアダイオードを商品化しました。	製品化・サービス化
Shureは2022年1月21日より、AONIC 50、ワイヤレス・ノイズキャンセリング・ヘッドホンの姉妹版となる「AONIC 40、ワイヤレス・ノイズキャンセリング・ヘッドホン」を販売開始する。	製品化・サービス化
シャトレーゼは、「節分スイーツ」を全国の同社店舗にて期間限定発売する。	製品化・サービス化
株式会社フォーティーズは北陸どこでもきっぷは北陸自由周遊区間内のJR西日本線の普通車自由席が乗り放題と当社提携ホテルもしくはお客様がご希望のホテル・旅館などをお手配するプランを発売開始です。	製品化・サービス化
漆塗りの自動車の鍵専用ケースが話題に、ユーチューバーとコラボ、伝統広める、漆の精製加工・漆塗り製品の販売などを行う「浄法寺漆産業」が、ユーチューバー「クルマ買う系チャンネル「ワンソクtube」」とコラボレーションしたカーセキュリティー用品「KEY GARAGE」を発売した。	製品化・サービス化
ゴールドウインが展開する「THE NORTH FACE」は、アクティブウェアとして天然繊維の紙糸を使用した「COMFORTIVEコレクション」を2月上旬より順次発売する。	製品化・サービス化
セイコーエプソン株式会社は、三井住友ファイナンス&リース株式会社の戦略子会社、SMFLみらいパートナーズ株式会社が供給する、オンサイト型自家消費太陽光発電サービスの活用を開始しました。	製品化・サービス化
サービス「かんたん位置情報サービス」において、センサーと連携させる屋内外測位の実証実験を東日本旅客鉄道株式会社水戸支社、株式会社シーイーシーと本日から開始致します。	研究・開発
アイカ工業は、家具・什器、内装壁面の表面材などに使える、すり傷や汚れがつきにくい化粧ボード「マーレス」シリーズを拡充する。	製品化・サービス化
世界自然遺産に登録された奄美・沖縄で相次ぐ希少種の密猟防止に向けて、環境省はタブレットで撮影した生き物を自動で判定するアプリケーションの開発を進めている。	研究・開発
DPI日本会議は、公益財団法人キリン福祉財団助成のもと、「インクルーシブまるごと実現プロジェクト」を2018年度より展開してきました。	製品化・サービス化
Mozillaは米国時間2月1日、2つの新しいプライバシー機能をVPNサービスに導入したと発表した。	製品化・サービス化
鈴研.陶業は、新規事業で美濃焼タイルを素材にしたジュエリーシリーズ「Re.Juile」を立ち上げた。	製品化・サービス化
家電・雑貨を企画販売する東大阪のメーカー、ライソン株式会社は、どこでも手軽に音楽を楽しみながら、7色のイルミネーション機能でオシャレ空間を演出する「スリムイルミネーションスピーカー、SP-33」を、2月10日より全国の量販店、、雑貨ショップ、ディスカウントストアで販売開始いたします。	製品化・サービス化
合同会社STARTは、2022年1月より、転職マッチングサービス「STARTarget」を提供します。	製品化・サービス化
横浜ゴムは、今年8月にタイヤ空気圧遠隔監視システムの実証実験を開始するなど、タイヤ市場や関連サービスの変化に対する取り組みを積極化している。	製品化・サービス化
間もなく中国の旧暦正月を迎えるのを機に、中国の嵩山少林寺と世界各地の少林文化センターは、国際的なカンフーコンテストである「Happy Chinese New Year: Shaolin Kung Fu Online Games」を開始した。	製品化・サービス化
日刊工業新聞社は、2022年2月28日に書籍「図解よくわかるフードテック入門」を発売した。	製品化・サービス化
セブンイレブン・ジャパンとファミリーマート、ローソンの大手コンビニ3社は15日、共同配送の実証実験を北海道で実施すると発表した。	研究・開発
Microsoftは最新OS「Windows 11」の中でも特に期待されていた、「Android」アプリの動作を可能にする新機能の提供をついに開始する。	製品化・サービス化
ミルボンと花王が、美容室での新たなビューティヘルスケアサービスの確立に向けた共同プロジェクトを開始する。	製品化・サービス化
Logitechが左手用モデルも用意されたM650マウスやMX Master/Anywhere 3のFinal Cut Pro設定をサポートしたユーティリティ「Logi Options+ v0.80」をリリースしています。	製品化・サービス化
クラブツーリズム株式会社は、インフラツーリズムの人気を受け、日帰りバスツアー「一度は見てみたいインフラの裏側!東京湾アクアライン裏側探検と貸切船で行く!羽田沖クルーズ特別航路」を好評販売しています。	製品化・サービス化
現地時間2月15日、ソニーは新型完全ワイヤレスイヤホン、「LinkBuds」、を発表した。	製品化・サービス化
サイコムは2月28日、第12世代インテルCoreプロセッサー「Alder Lake-S」を搭載した「モンスターハンターライズ」推奨PCとして、「G-Master Spear Z690/D4-MHR」を発売した。	製品化・サービス化
ビザスクと住友商事は、量子技術を起点としたイノベーション創出を目指す取り組みを開始した。	その他
若い世代をターゲットにした農業ウェアの販売などを行う。	製品化・サービス化
「ロボティクスで、世界をユカイに。」を掲げ、数多くのコミュニケーションロボットやIoTプロダクトを企画・開発するユカイ工学株式会社は、やみつき体感ロボット「甘噛みハムハム」のクラウドファンディングを2022年3月8日よりCAMPFIREにて開始しました。	製品化・サービス化
ファミリーマートは2月22日より、「ホットケーキなスフレ・プリン」を全国発売する。	製品化・サービス化
株式会社マンダムは、ヤング女性向けヘアメイク&ヘアケアブランド ルシードエルから、セルフで気軽にインナーカラーを楽しめる「#インナーデザインブリーチ」、「インナーカラートリートメント」を、2022年2月21日より新発売します。	製品化・サービス化
パナソニック システムソリューションズ ジャパン株式会社は、ハンバーガー・レストラン・チェーンの事業展開を図る日本マクドナルド株式会社が、2012年2月10日からスマートフォン対応公式アプリとしてサービスを開始する予定の「スクラッチdeクーポン」を開発・納入しました。	製品化・サービス化
アパレルブランド「10YC」は、自社商品の二次流通サービス「ARATAME」を開始。	製品化・サービス化
JX通信社は、「報道の機械化」に取り組む基本姿勢のもと、官公庁や報道機関にSNS発のリスク情報を配信する「FASTALERT」や速報ニュースアプリ「NewsDigest」などのサービスを開発・提供しています。	製品化・サービス化
株式会社日立ソリューションズは、流通・小売分野などの共通ポイントを導入する加盟店を対象に、4大共通ポイントの事業者が運営するシステムと1つのゲートウェイで接続できるクラウドサービス「PointInfinity、マルチポイントゲートウェイ」を1月26日から提供開始します。	製品化・サービス化
団体契約で業界初あいおいニッセイ同和損害保険株式会社は2月18日、団体総合生活補償保険、「八大疾病一時金補償特約」の販売を開始すると発表した。	製品化・サービス化
マキタは、同社の40Vmaxリチウムイオンバッテリーを電源とする「充電式インパクトドライバ、TD002G」を発売した。	製品化・サービス化
発売ミニストップは、「キラキラ輝く、心トキメく。こだわりのトレンドスイーツ」というコンセプトの~ Sweets Carat ~ ~第2弾として、昨今人気の高い、あんことバターを使用したスイーツをアレンジした新感覚の「あんバターミルフィーユサンド」を、2022年1月18日より国内のミニストップ店舗にて発売します。	製品化・サービス化
マリオット・インターナショナルが展開するホテル・W、大阪は、"苺"尽くしのアフタヌーンティーや苺のデザートコースを2022年1月16日より提供する。	製品化・サービス化
米上場のコンピュータネットワーク機器メーカーのネットギアは3日、デジタルアートフレーム製品の「ミューラル」に暗号資産ウォレットMetaMaskを統合し、NFTの展示を可能にすることを発表した。	その他
浜松市は4日、地域経済活性化策としてキャッシュレス決済のauPAY、楽天Edyと連携したポイントバックキャンペーンを21日から3月20日まで実施すると発表した。	製品化・サービス化
エムエスアイコンピュータージャパンは、NVIDIA GeForce RTX 3060 Laptopを搭載するゲーミングノートPC「GF65-10UE-437JP」を発表した。	製品化・サービス化
詳しくはこちら発表日:2022年01月12日AIを用いた太陽光発電量予測でインバランスリスクの低減を支援電力市場向けに、高精度な太陽光発電量予測データをAPI提供1kmメッシュの高精度な日射量データを用いて、30分毎のPV発電量を予測株式会社ウェザーニューズは、気象データと最新技術で企業のDXを推進する気象データ提供・分析サービス「WxTech」において、電気事業者向けに1kmメッシュの高解像度な日射量予測を用いた太陽光発電量予測データのAPI提供を開始しました。	製品化・サービス化
花の産地、田原の花を観光客らに持ち帰ってもらおうと、田原市堀切町の住民有志でつくる「堀切地区ボランティアの会」は12日、「花畑プロジェクト」として町内の国道42号沿いで育てたストックの花摘み体験を試験的に始める。	その他
暗号資産のマネーロンダリング対策ソリューションなどを提供するエリプティックが、機関投資家の暗号資産トレードに焦点を当てた新しいプロダクトを開発中であることを発表した。	研究・開発
ハンファQセルズジャパン株式会社は、2050年カーボンニュートラル実現に向け日本政府が認証する制度"J-クレジット"を活用して、太陽光発電システムを設置する住宅に向けて「CO2削減プロジェクト」を開始いたします。	製品化・サービス化
NECネッツエスアイは、ビデオ会議サービス「Zoom」を運営する米ズーム・ビデオ・コミュニケーションズが提供するクラウド型の音声サービスに、手軽に利用できる独自サービスを追加すると発表した。	製品化・サービス化
途上国の水・衛生支援に取り組む国際NGOである特定非営利活動法人ウォーターエイドジャパンは、3月22日の世界水の日に向けて、世界を青く染めるキャンペーン「#Blue4Water」を実施します。	製品化・サービス化
住友ゴム工業は、市販タイヤ事業で電動車戦略を加速する。	製品化・サービス化
富士通株式会社は7日、富士通研究所が開発している行動分析技術「Actlyzer」の機能を拡張し、店舗内のカメラ映像から顧客の行動を特定し、人・モノ・環境の関係性をグラフ表現した行動シーングラフとして認識する映像認識AI技術を開発したと発表した。	研究・開発
ハンファQセルズジャパンと住友電気工業は2022年3月1日、太陽電池モジュールとハイブリッド蓄電システムを一体化した、住宅向けの太陽光発電の自家消費システムを開発すると発表した。	研究・開発
障害者向けの福祉施設を運営する一般社団法人スマイルベースが、利用者の描いた絵などをあしらった衣類や雑貨の商品化に取り組んでいる。	製品化・サービス化
ユニバーサル・スタジオ・ジャパンは20日、人気ゲーム「モンスターハンター」の世界を仮想現実で楽しむアトラクションを報道陣に公開した。	製品化・サービス化
全国30店舗を展開するフランチャイズ本部、ビッグクリエイト株式会社から、バレンタイン期間限定で「KUMA3daポン」と「ヨーロッパのドーナツ」を発売する。	製品化・サービス化
住友不動産株式会社は、「シティテラス稲毛海岸」の販売を開始した。	製品化・サービス化
Xiaomiは、新型スマートフォン、「Redmi Note 11」、を日本市場向けに発売する。	製品化・サービス化
ポケモンセンターは1月8日、「成長」をテーマにコリンク・ルクシオ・レントラーをモチーフにしたグッズ「MY RENTORAR'S STORY」シリーズを発売する。	製品化・サービス化
英国に拠点を置く人工知能企業、ディープマインドが、世界レベルの人工知能をハードサイエンスの課題に応用する一連の取り組みを続けている。	その他
USEN-NEXT HOLDINGSのグループ会社であるUSENは、3月10日から開業時の資金調達などに役立つ融資制度「経営力強化資金」の申し込みを無償でサポートする事業を始めた。	製品化・サービス化
この対策としてJALグループはIT資産管理ソフトウェア「PalletControl」を導入している。	製品化・サービス化
コミュニティコマース関連サービスを提供する株式会社ライスカレーは、TikTokクリエイターを含めたパートナーインフルエンサー500名以上と提携し、新たにTikTokコンテンツ活用サービスを提供します。	製品化・サービス化
スズキが月額定額で利用できる中古車のサブスクサービス「スズキ定額マイカー」を開始スズキは、月額定額で利用できる中古車のサブスクリプションサービス「スズキ定額マイカー」を開始した。	製品化・サービス化
極楽鳥製薬株式会社は、「性能」と「快適な健康維持」を目的としたホームヘルス機器ブランド「Tech Love」を展開しています。	製品化・サービス化
東陽テクニカは2022年2月8日、ビルド高速化ツール「Incredibuild」を販売開始した。	製品化・サービス化
エクソルは2022年2月8日、太陽光発電の設備、法的デューデリジェンス、発電量などを検査・評価してランク付けし、価格査定する新サービス「XSOL SOLAR STAR、制度」を開始すると発表した。	製品化・サービス化
PayPayは、PayPayのミニアプリにおいて自動車整備の出張サービス「Seibii」の提供を開始した。	製品化・サービス化
株式会社リアライズは、1月24日〜1月28日までの期間中、アニメ・漫画専門ECサイトであるAnimoで「ぎゅぎゅっとアクリルキーホルダー テイルズ オブ アライズ」の予約販売を開始いたします!	製品化・サービス化
井上康)は、株式会社ISARIBIとの、新エンタメ・ソリューションプロジェクト「楔計画」として、コラボレーションワインをプロデュース。	製品化・サービス化
米CEVAは、複数のダイを1パッケージに収めた先端ロジックICに向けて、IPコアの新製品「Fortrix SecureD2D IP」を2022年1月26日に発表した、ニュースリリース、。	製品化・サービス化
冷凍プリンソフト株式会社は、2022年2月8日に「びん焼きあいす」を発売します。	製品化・サービス化
ダイゴー株式会社は、様々なツールを自分で組み合わせて1冊の手帳をつくるハンディピックシリーズの使い方を提案する公式サイトを2022年2月1日にオープンいたしました。	製品化・サービス化
システムインテグレータは2022年1月5日、データベース操作ツール「SI Object Browser」とERモデリングツール「SI Object Browser ER」の新版を発表した。	製品化・サービス化
株式会社NTTドコモはDataMesh株式会社が提供する「DataMesh Director」を「5G」に対応したパートナーソリューションとして、2022年1月31日から法人向けに販売開始することを発表した。	製品化・サービス化
千葉大学発医療スタートアップ企業である株式会社Smart119は、神戸医療生活協同組合、神戸協同病院が、医療事業継続支援システム「respon:sum」を導入し、運用開始したことを発表します。	製品化・サービス化
BANDAI SPIRITSは、ハズレなしのキャラクターくじ「一番くじ、<くまのプーさん>原作デビュー95周年Anniversary」を7月上旬に発売する。	製品化・サービス化
慶應義塾大学は2022年2月21日、同大学と中国科学院大学カブリ理論科学研究所の共同研究チームが、磁気回転効果を用いて磁性体から起電力を取り出す機構を理論的に発見したと発表した。	研究・開発
同社は、通信事業者のメールサービスにおけるセキュリティ対策と、一般企業向けにMicrosoftのクラウドサービスと連携するメールセキュリティ機能を提供する。	製品化・サービス化
ビットフォレストは、クラウド型ウェブ脆弱性診断ツール「VAddy」において、無料トライアルを含む全プランで「Log4Shell」の検査機能を1月31日までの期間限定で提供している。	製品化・サービス化
パナソニック コンシューマーマーケティング株式会社は、公式直販サイトパナセンスで「WiMAX Service」を販売しております。	製品化・サービス化
パナソニック株式会社、インダストリアルソリューションズ社は、高度な画像処理や検査を手軽に行える画像センサー「SVシリーズ」を開発し、2020年6月に日本での発売を開始しました。	製品化・サービス化
「HOGUSU」新発売:時事ドットコム、天然鉱石を練りこんだ繊維で血行促進、創業70年の老舗アパレルメーカー・クロスプラス株式会社は、血行促進を促し日々の疲れをほぐすリカバリーウェア「HOGUSU」を自社運営ECサイトおよび全国の量販店、ホームセンター、ドラッグストア等で2022年1月25日より順次販売開始いたします。	製品化・サービス化
MHD、モエ ヘネシー ディアジオは、シングルモルト・ ウイスキーの「グレンモーレンジィ」より、限定商品「グレンモーレンジィ ウィンター」を発売した。	製品化・サービス化
ロックバンド「JUN SKY WALKER」が、2012年以降に発売したアルバムのサブスクリプション配信を来月から開始すると発表した。	製品化・サービス化
