暗号資産交換業大手Binanceは、法定通貨と暗号資産の決済サービスを手掛ける新会社「Bifinity」を設立したと発表した。	製品化・サービス化
暗号資産プラットフォームのCrypto.comは28日、米NBA大物プレイヤーのレブロン・ジェームス氏の非営利団体と提携し、Web3.0関連のプログラムを数年間にわたって展開すると発表した。	製品化・サービス化
環境省と奄美市は、奄美大島の希少野生生物の観察スポットとして夜間の車両通行を規制している奄美市住用の市道・三太郎線に、車のナンバーを読み取るカメラを26日導入する。	製品化・サービス化
Nuverseは、Android/iOSタイムシンクロRPG「ユグドラ・レゾナンス」を2022年春に配信する。	製品化・サービス化
新日本製薬が、女性の心と体に寄り添うフェムケアブランド「COCOROOT」を立ち上げた。	製品化・サービス化
広告・出版物のデザイン制作などを手掛けるデジタルデビジョンは28日から、テレビアニメ「進撃の巨人、The Final Season」とコラボレーションした商品を展開する。	製品化・サービス化
損害保険ジャパン株式会社とSOMPOリスクマネジメント株式会社は、日清紡ホールディングス株式会社傘下の日清紡マイクロデバイス株式会社と、最先端の音響センサを活用した「音響診断AI化支援コンサルティング」の利便性向上とAI導入企業の更なる安心・安全の提供を目指す協業を2022年2月から開始します。	その他
合同会社ReCropは、慶応義塾大学、青山学院大学の現役学生を中心としてSDGsやLGBTQ+への認知度向上・理解促進を目指す事業を行っております。	製品化・サービス化
病気や障害のある家族の世話や家事を担う18歳未満の「ヤングケアラー」を支援しようと、平塚市は対象世帯に無料の宅配弁当を提供する「見守り事業」を4月からスタートさせる。	製品化・サービス化
株式会社ロッテは4月5日にBTSメンバーの笑顔がデザインされたオリジナルパッケージの「キシリトールBTS、バブルガム<フルーツミックス>」を数量限定で発売します。	製品化・サービス化
アダコテック、数十枚の不良データから高精度の欠陥分類を可能とする異常検知AIソリューションの提供を開始、本田技研工業への導入事例を精密機械工学会にて発表:時事ドットコム、~、複数の欠陥分類を自動化し検査データを活用した良品率の向上に寄与、~「高次局所自己相関特徴抽出法」1を用いた画像解析によりモノづくりの検査・検品の自動化を促進する株式会社アダコテックは、欠陥の種類を判別・分類可能な技術を開発し、2015年より提供を開始した不良品判定のシステムの拡張機能として、2022年2月より本格提供を開始しました。	製品化・サービス化
WWFとパナソニック株式会社は、中国と朝鮮半島に囲まれた海域・黄海の環境保全をめざし、2007年より7年計画で「黄海エコリージョン支援プロジェクト」を推進しています。	その他
株式会社しむらは、春の訪れを感じる「さくらエプソム」を3月1日、数量限定で発売します。	製品化・サービス化
「ヴァレンティ」が、サステナビリティプロジェクト「オープン フォー ア チェンジ」を始動し、プロジェクト初のアイテムとしてデザインを一新した定番スニーカー2型を発売した。	製品化・サービス化
BMWが高速道路を走れる電動スクーターを発表しました。	製品化・サービス化
「ノワ・ドゥ・ブール」は、ベルギー王室御用達チョコレートブランド「ヴィタメール」とコラボレーションした「焼きたてフィナンシェ」を販売いたします。	製品化・サービス化
東京大学や情報学研究所と企業6社は2月28日、異なる分野のデータ基盤を連携するコネクターと、さまざまなデータ基盤を横断的に検索できるようにする技術を開発したと発表した。	研究・開発
2022年1月19日、ワンダーテーブル社は、元麻布に構えるデリバリー専門キッチンより「短角和牛ハンバーグ、しおた」をオープンする。	製品化・サービス化
パナソニック ファクトリーソリューションズ株式会社は、プリント基板に電子部品を実装する前工程で使用されるクリームはんだ用スクリーン印刷機の新機種SPVを2015年6月より受注開始しました。	製品化・サービス化
株式会社JSOLは10日、株式会社東京商工リサーチのデータを活用し、企業の成長予測スコアと関連する企業情報を閲覧できるサービス「FinCast、成長予測」を提供開始すると発表した。	製品化・サービス化
年金積立金管理運用独立行政法人は、2021年12月からヘッジ目的の株価指数先物の取引を開始した。	製品化・サービス化
パナソニック株式会社は、360度映像を非圧縮4K/30pで出力可能な360度ライブカメラを2017年9月20日より発売します。	製品化・サービス化
福島県は19、20の両日、福島県いわき市のイオンスタイルいわき小名浜で、県産水産物を使用した新たな県認定の加工品「ふくしま海の逸品」の実証販売を実施している。	研究・開発
デジタル庁は、訪日外国人観光客らを対象とした入国手続き支援アプリを改良する。	製品化・サービス化
株式会社、マリークヮント コスメチックスは、2022年2月4日より、簡単に眉メイクの完成度を上げながら眉毛ケアも叶う眉マスカラ「ブロウ フィニッシュ<眉墨>」の販売を開始いたします。	製品化・サービス化
次に、モデルナは研究対象となるワクチンをさらに増やすため、世界中の研究者が新たに出現した、あるいは顧みられない感染症の研究にモデルナのmRNA技術プラットフォームを利用することのできる、新しいプログラム、mRNAアクセスの提供を開始します。	製品化・サービス化
マルサンアイ株式会社は、「豆乳飲料ピスタチオ」を2022年2月10日に東海北陸エリアにて先行発売し、3月1日より全国発売いたします。	製品化・サービス化
サッポロホールディングス株式会社のグループ企業であるサッポロビール株式会社は、サステナビリティ重点課題のひとつに挙げている地球温暖化防止を目的に、2022年1月に群馬工場尾島事業所へPPAモデルによる太陽光発電設備を導入しました。	製品化・サービス化
渡辺航原作によるアニメ「弱虫ペダル、GLORY LINE」のキャラクターをモチーフにしたシルバーペンダントが、エテルノレシより受注生産品として発売される。	製品化・サービス化
医師専門の資産形成コンサルティングを行う株式会社トライブホールディングスは、2022年2月1日に有料職業紹介事業の許可を取得いたしました。	製品化・サービス化
LEDライトの「スフィアライト」ブランドを手がけるスプレッドは、ライトのカスタム需要の喚起に取り組む。	
NTN 、は17日、軸受の異常を検知する「NTNポータブル異常検知装置」を海外で販売すると発表した。	製品化・サービス化
日本ゼオンは11日、シクロオレフィンポリマーのリサイクル技術の開発に成功し、量産設備を建設すると発表した。	製品化・サービス化
FCNTが、らくらくスマートフォンやarrows向けの会員サービス「La Member's」を2月24日から提供する。	製品化・サービス化
LG電子は28日、欧州プレミアム完成車メーカーから次世代車両用5G移動通信テレマティクス部品を受注したと発表した。	製品化・サービス化
ロボット開発のベンチャー企業である株式会社スマートロボティクスは専用タブレットをワンクリックするだけで、ロボット本体のセンサーが自己位置と走行路を検出して自律走行する殺菌灯搭載ロボット「SR-UVC」モデルCの開発、販売を開始したことを発表した。	製品化・サービス化
木内建設グループのフジ都市開発は、新宿区市谷田町に賃貸マンションを建設する。	製品化・サービス化
びゅうトラベルサービスは、JR東日本が運行するクルーズトレイン「TRAINSUITE四季島」の今秋10、11月出発商品を2月3日から発売した。	製品化・サービス化
Afternoon Tea LIVINGがイチゴをモチーフにしたアイテムを展開。	製品化・サービス化
KDDI株式会社、韓国Samsung Electronics、富士通株式会社の3社は18日、世界で初めて、商用ネットワークに接続するオープン化した5Gスタンドアローン、の仮想化基地局によるデータ通信に成功したと発表した。	研究・開発
エレコム株式会社は、タワー型で机の上にも設置しやすく、AC差込口対応機器やUSB電源機器をまとめて接続できるUSBポート搭載のタワー型タップを新発売いたしました。	製品化・サービス化
8団体は、18年から国立研究開発法人新エネルギー・産業技術総合開発機構が管理法人として運営を支援する内閣府「戦略的イノベーション創造プログラム第2期」で採択された「ビッグデータ・AIを活用したサイバー空間基盤技術」の研究開発を推進してきた。	研究・開発
Anker Japanが充電ケースとあわせて最大28時間の音楽再生が可能な完全ワイヤレスイヤホン「Soundcore Life P2i」を発売しています。	製品化・サービス化
そんななか、米サンフランシスコ発のライフスタイルブランド「オールバーズ」は、昨年2021年の世界アースデーに「カーボンフットプリント算出キット」を公開した。	製品化・サービス化
2022年1月5日、ソニー・インタラクティブエンタテインメントはCES2022にて、PlayStation 5向け次世代バーチャルリアリティシステムの正式名称を「PlayStation VR2」に決定したと発表。	その他
大分県宇佐市のNPO法人「安心院町グリーンツーリズム研究会」は市内の農村民泊で、同町特産のスッポンを使った料理の提供を始めた。	製品化・サービス化
機内食などを製造・販売する名古屋エアケータリングは、弁当販売や食堂受託、FC店運営などに乗り出している。	製品化・サービス化
台湾ASUSは1月5日、「ROG」ブランドのゲーミングノートPC新製品として、発表されたばかりのモバイル向け第12世代Intel CoreやAMD Ryzen 6000シリーズ、NVIDIA GeForce RTX 3080 Ti LaptopやRadeon 6000Sシリーズを搭載する、「Strix SCARシリーズ」「Strix Gシリーズ」「Zephyrus Duo 16」「Zephyrus G14」「Flow Z13」を発表した。	製品化・サービス化
読売新聞の記事によれば、防衛省が敵対的なドローンを無力化できる「高出力マイクロ波」兵器の研究開発に乗り出すそうだ。	研究・開発
料理教室の動画配信を開始した。	製品化・サービス化
スペースマーケットは「スペースシェアをあたりまえに」をミッションに掲げ、あらゆる場所を1時間から貸し借りできる、スペースシェアのプラットフォームサービスを提供しています。	製品化・サービス化
女性のバイオリズムや体の変化に寄り添うセルフケアブランド「WRAY」を展開する株式会社WRAYは、デリケートゾーンケアや産前の会陰マッサージに使える100%天然由来成分、COSMOS基準処方のオーガニック*デリケートゾーンケアオイル、「NATURAL INTIMATE OIL」を2022年3月8日より公式オンラインストア、WRAY楽天市場店、amazonストアにて順次発売いたします。	製品化・サービス化
東急は2月22日、東急田園都市線と大井町線の二子玉川駅に直結する複合型商業施設「二子玉川ライズ」の「P3駐車場」において、電気自動車の国内での普及促進に向けた新たな取り組みを開始すると発表した。	その他
NECは2021年1月、汎用のIAサーバーで利用できるPCIEカード型ベクトルエンジンの単体販売を開始。	製品化・サービス化
日本の文化ポテンシャルの発展を目指す「アート東京」は、、NFTマーケットプレイス「Future Art Tokyo Collection」の版の提供を開始した。	製品化・サービス化
「生活の木」は、大人気商品「キンモクセイ」に続き、季節限定商品として、ミモザエッセンシャルオイルを配合した「ミモザシリーズ」全6種を2月9日に発売した。	製品化・サービス化
ベルキンは2月28日、MagSafeに対応したiPhone 13 / iPhone 12シリーズを15Wで非接触充電できる「Belkin BOOSTCHARGE PRO MagSafeポータブルワイヤレス充電パッド15W」を発表した。	製品化・サービス化
小田原市に本社を置くHamee株式会社では、周辺エリアに住む正社員を対象に手当を支給する「小田原手当」を、2020年にスタートしました。	製品化・サービス化
テキサス州リチャードソン、- 2022年1月5日、-、フォッシルとRazerは、共同で限定スマートウォッチ「Razer X Fossil Gen 6 Smartwatch」を発売します。	製品化・サービス化
フィリップス・ジャパンは2月8日、シェーバー製品で最上位となる「S9000」シリーズの新モデルを発表。	製品化・サービス化
株式会社ぐるなびは、新規ユーザー獲得と既存ユーザーのネット予約の促進を目的に「ぐるなびネット予約クーポン」の本格提供を2022年1月26日より開始します。	製品化・サービス化
エアデジタル株式会社は、大型スクリーン、VR、ARを駆使する体験型デジタルスポーツフィールド、PCゲームがメインとなるE-SPORTSフィールドの2つで構成されるスポーツクラブの新業態「スポーツ60&スマート」を新たに立ち上げます。	製品化・サービス化
JAOSは「Experience a New Adventure.」をスローガンに掲げ、1985年の創業以来、一人でも多くのお客様に新たな冒険を体験していただけるよう4WD&SUV用パーツの開発や提供を続けています。	研究・開発
東日本電信電話株式会社北海道事業部は、、幌加内町において、町内の小中学生を対象としたプログラミング体験会を実施します。	製品化・サービス化
ラトナ株式会社とエッジAIの半導体、ソフトウェアを提供するBlaize, Incはエッジコンピューティング製品を用いたビジネスの拡大、展開を目的として、事業協業を開始しました。	製品化・サービス化
日本インターネットエクスチェンジ株式会社は、株式会社QTnetの「福岡第3データセンター」にて、インターネットエクスチェンジサービスである「JPIX福岡サービス」を2022年2月から新たに開始いたします。	製品化・サービス化
株式会社オトナルは、ポッドキャスト間のリスナー送客を定量的に可視化するトラッキングサービスの提供を開始しました。	製品化・サービス化
JTBパブリッシングは8日、「今、泊まりたい1棟貸しの宿、100」を発売した。	製品化・サービス化
東京大学などによる研究グループは3月10日、植物の形態的、生理的な性質を観測する自走式装置「高速フェノタイピングローバー」を開発し、その設計をオープンソース・ハードウェアとして公開したと発表した。	研究・開発
インフィニオン テクノロジーズ ジャパンは、同社でマイコンやセキュリティICなどを展開するCSS事業の概況を説明するとともに、量子コンピュータ時代に対応する新世代のTPM製品「OPTIGA TPM SLB 9672」を発表した。	製品化・サービス化
パナソニック株式会社は、2017年8月1日~9月30日の2カ月間にわたり、ステラボールで開催される体験型エンターテインメント、フエルサ ブルータ、「Panasonic presents WA! -Wonder Japan Experience」への特別協賛と技術協力、ならびに出資を行い、映像を中心とした、新たな空間演出ソリューションのトライアルを実施します。	その他
あいおいニッセイ同和損保は、テレマティクスデバイスから取得する車両の位置情報と人工衛星を利用して算出した浸水深データを掛け合わせ、広域災害における浸水車両の保険金早期支払に向けた実証実験を、スイス再保険と共同で2月1日より開始した。	製品化・サービス化
クラフトビール醸造所「備後福山ブルーイングカレッジ」は、同市の花・バラから採取した酵母を使ったクラフトビール2種類を販売している。	製品化・サービス化
アウディジャパンは1月17日、新型電動SUV「Q4 e-tron」「Q4スポーツバック、e-tron」を発表、2022年秋以降に販売を開始する。	製品化・サービス化
「金融庁、地域企業経営人材マッチング促進事業、人材データベースREVICareer」利用開始により中小事業者の人材雇用支援を強化:時事ドットコム、、大阪信用金庫は、1月17日より中小事業者の人材雇用に関する課題に対し、更なるソリューションの充実を図るため、「金融庁、地域企業経営人材マッチング促進事業、人材データベースREVICareer」の利用を開始しました。	製品化・サービス化
600は、冷凍パンの無人販売に特化した「Store600 BAKERY」の提供を開始した。	製品化・サービス化
フォションホテル京都は、初のオリジナルショコラをバレンタインシーズンに合わせて発売。	製品化・サービス化
ハイエンドを中心としたBTOパソコンの企画・製造・販売を手掛ける株式会社サードウェーブは、全国のコンピューターショップ ドスパラ、各店舗、およびドスパラ通販サイトにて、NVIDIAの最新世代GPU「GeForce RTX 30シリーズ」より、エントリーモデル「GeForce RTX 3050」を搭載したパソコンの販売を開始しました。	製品化・サービス化
本ゲームを協賛する株式会社チヨダは、「東京靴流通センター」や「シュープラザ」をはじめとした靴専門店を全国展開しています。	製品化・サービス化
LANDICは、福岡市内で共同住宅の建設を計画している。	研究・開発
東京海上日動火災保険株式会社は2022年2月15日より、事故の連絡から保険金の受け取りまでを、いつでもWeb上で完結できるシステムを導入した。	製品化・サービス化
ファミリーマートは1月25日から、持ち手部分を穴の開いたデザインにしてプラスチックの使用量を削減した「フォーク」の取り扱いを開始する。	製品化・サービス化
声優「細谷佳正」「ZEENY」コラボレーションイヤフォン&ワイヤレス充電器が、40歳の誕生日を記念して2月10日から受注販売開始。	製品化・サービス化
ラデュレは、ホワイトデーに向けた限定マカロンボックスを、2022年2月25日よりラデュレ全店にて販売する。	製品化・サービス化
カー用品販売の昌騰、MAXWINから、Power Delivery USBタイプCとQuick Charge 3.0 USBに対応したUSBカーチャージャー「PCA33」の販売が開始された。	製品化・サービス化
ワタミは寿司と焼き鳥ダブルメーンの業態をオープンし、多様な事業会社を擁するアークランドサービスホールディングスでは専門性を推進。	製品化・サービス化
日立建機と日立製作所は、日立建機のデジタルトランスフォーメーション加速に向けて、建設機械の稼働情報や生産・販売・在庫情報などを一元管理し、データの利用/活用を促進するプラットフォーム「DX基盤」を構築した。	製品化・サービス化
酒類・食品卸売業の伊藤忠食品株式会社は、茶懐石・京料理・京懐石の料亭として165年以上の歴史がある株式会社下鴨茶寮の商品を取り揃えた、「下鴨茶寮ギフトカード/コードギフト」の取り扱いを開始しました。	製品化・サービス化
リゾートワークスは、サウナなどのウェルネス体験を楽しむことができる会員制サービス「リゾートサウナ」をリリースいたします。	製品化・サービス化
ユニットコムは1月20日、「iiyama PC」ブランドのゲーミングシリーズ「LEVEL」から、「PSO2、ニュージェネシス」推奨PCを発売した。	製品化・サービス化
ビッグローブは、BIGLOBE WiMAX +5Gにおいて5G対応のホームルーターとモバイルルーターを2月1日から取り扱う。	製品化・サービス化
「金型を用意できない」というお客様に向けて「金型製作代行サービス」を開始:時事ドットコム、株式会社オリジナルマインドは、「金型を用意できない」というお客様に向けて「金型製作代行サービス」を開始しました。	製品化・サービス化
HTC NIPPONは3月2日、VRゴーグルの割引に加え、さらにVR SNSへの登録や利用までサポートする「メタバースデビュー応援キャンペーン」を開始した。	その他
詳しくはこちら多様な観点からニュースを考えるパナソニックは28日、2023年度中に電気自動車用の新型電池を量産すると正式発表した。	製品化・サービス化
圧倒的パフォーマンスと安定性を誇るゲーミングPC GALLERIAシリーズを展開する株式会社サードウェーブは、2022年2月3日より、全国のコンピューターショップ「ドスパラ」各店舗、およびドスパラ通販サイトにて、最新グラフィックボードAMD Radeon RX 6500 XTを搭載したゲーミングPCを2機種販売開始しました。	製品化・サービス化
2016年8月23日にサービスを開始したDAZNは、同年のベルギーGPからF1のライブ配信を開始。	製品化・サービス化
ブルーレイビデオの映画や、デジタル放送のスポーツ・音楽番組などを、大画面テレビと迫力のサラウンドで楽しむテレビラックにシアターを内蔵したタイプである、ラックシアターの市場が拡大しています。	製品化・サービス化
柔道整復師が施術を行う徳永接骨院では、長引く自粛生活で中学生の猫背による体調不良が増えたことから、家庭でケアできるオンライン動画プログラムを発売します。	製品化・サービス化
サードウェーブは、最新の第12世代、Intel Core i7-12700、およびi5-12400を搭載したパソコン「GALLERIA XA7C-R36T、第12世代Core搭載」「raytrek XF、第12世代Core搭載」「Magnate IM 16GB/i5-12400搭載モデル」を発売した。	製品化・サービス化
ダウンブランドの「カナダグース」が、自社のサプライチェーンからアップサイクルした余剰生地を使用したパッチワークパーカを2月19日に発売する。	製品化・サービス化
ヒルトン東京からは、フランスの高級チョコレートブランド"ヴァローナ"などが贅沢に用いられた「マンディアン・ラブレター」がテイクアウト用で発売。	製品化・サービス化
ソニーグループは、自社でEVに参入する。	製品化・サービス化
アイシングループのアドヴィックスは、高効率で高精度な油圧ブレーキと回生ブレーキを協調制御する「回生協調ブレーキ」システムの次期型を開発し、2025年までに実用化する。	製品化・サービス化
Ankerは、2,5601,440ドット解像度に対応したWebカメラ「PowerConf C200」を発売した。	製品化・サービス化
NECは2022年1月20日、ローカル5G向けの新たな基地局「UNIVERGE RV1000シリーズ」の2機種を発表した。	製品化・サービス化
西日本ジェイアールバスが特別仕様の貸切バス「花嫁のれん第二章」を導入。	製品化・サービス化
